[
  {
    "id": "vandikkaran-magan-s029-d001",
    "scene_id": "vandikkaran-magan-s029",
    "scene_ordinal": 29,
    "source_scene_id": "23",
    "source_heading": "காட்சி-23",
    "speaker_label": "விங்கன்",
    "source_delimiter": ":—",
    "source_scene_file": "scene-029.md",
    "page_provenance": [
      {
        "pdf_page": 42,
        "printed_page": 41
      }
    ],
    "text": "உமா, இதான் டேவிட் துரை பங்களா!..கோடை காலத்தில் இங்கதான் வந்து தங்குவார்..நான்கூட வந்திருக்கேன்!.."
  },
  {
    "id": "vandikkaran-magan-s029-d002",
    "scene_id": "vandikkaran-magan-s029",
    "scene_ordinal": 29,
    "source_scene_id": "23",
    "source_heading": "காட்சி-23",
    "speaker_label": "ஜம்பு",
    "source_delimiter": ":—",
    "source_scene_file": "scene-029.md",
    "page_provenance": [
      {
        "pdf_page": 42,
        "printed_page": 41
      }
    ],
    "text": "சார்! சார்! நீங்களா? வாங்க-வாங்க-அம்மா யாரு?.. சாருக்குக் கல்யாணம் ஆயிட்டுதா?..என்ன சார் எனக்கு ஒரு பத்திரிகைகூட அனுப்பலே!.."
  },
  {
    "id": "vandikkaran-magan-s029-d003",
    "scene_id": "vandikkaran-magan-s029",
    "scene_ordinal": 29,
    "source_scene_id": "23",
    "source_heading": "காட்சி-23",
    "speaker_label": "விங்கன்",
    "source_delimiter": ":—",
    "source_scene_file": "scene-029.md",
    "page_provenance": [
      {
        "pdf_page": 42,
        "printed_page": 41
      }
    ],
    "text": "(ஜம்புவின் வாயைப் பொத்தி)...ஏ, ஏ!..சும்மா இரு!..உமா!..நீ உள்ளே போ!..."
  },
  {
    "id": "vandikkaran-magan-s029-d004",
    "scene_id": "vandikkaran-magan-s029",
    "scene_ordinal": 29,
    "source_scene_id": "23",
    "source_heading": "காட்சி-23",
    "speaker_label": "ஜம்பு",
    "source_delimiter": ":—",
    "source_scene_file": "scene-029.md",
    "page_provenance": [
      {
        "pdf_page": 42,
        "printed_page": 41
      }
    ],
    "text": "சார்!..உங்களுக்கு ரொம்பப் பொருத்தம் சார்!..."
  },
  {
    "id": "vandikkaran-magan-s029-d005",
    "scene_id": "vandikkaran-magan-s029",
    "scene_ordinal": 29,
    "source_scene_id": "23",
    "source_heading": "காட்சி-23",
    "speaker_label": "விங்கன்",
    "source_delimiter": ":—",
    "source_scene_file": "scene-029.md",
    "page_provenance": [
      {
        "pdf_page": 42,
        "printed_page": 41
      }
    ],
    "text": "சரி! சரி!..சாவிக்கொத்தை என்கிட்டே கொடுத்துட்டு...சாப்பாட்டுக்கு முதல்ல ஏற்பாடு பண்ணு!"
  },
  {
    "id": "vandikkaran-magan-s029-d006",
    "scene_id": "vandikkaran-magan-s029",
    "scene_ordinal": 29,
    "source_scene_id": "23",
    "source_heading": "காட்சி-23",
    "speaker_label": "ஜம்பு",
    "source_delimiter": ":—",
    "source_scene_file": "scene-029.md",
    "page_provenance": [
      {
        "pdf_page": 42,
        "printed_page": 41
      }
    ],
    "text": "இப்பவே ரெண்டு கோழி அடிக்கிறேன்!"
  }
]
