[
  {
    "id": "vandikkaran-magan-s006-d001",
    "scene_id": "vandikkaran-magan-s006",
    "scene_ordinal": 6,
    "source_scene_id": "5",
    "source_heading": "காட்சி — 5",
    "speaker_label": "டேவிட்",
    "source_delimiter": ":—",
    "source_scene_file": "scene-006.md",
    "page_provenance": [
      {
        "pdf_page": 12,
        "printed_page": 11
      }
    ],
    "text": "ஹூ~ ஆர் யூ? யார் நீ?"
  },
  {
    "id": "vandikkaran-magan-s006-d002",
    "scene_id": "vandikkaran-magan-s006",
    "scene_ordinal": 6,
    "source_scene_id": "5",
    "source_heading": "காட்சி — 5",
    "speaker_label": "சொக்",
    "source_delimiter": ":—",
    "source_scene_file": "scene-006.md",
    "page_provenance": [
      {
        "pdf_page": 12,
        "printed_page": 11
      }
    ],
    "text": "நான் யாருங்கிறது அப்புறம் இருக்கட்டும்...இன்னேரம் நான் வந்து இங்கே ஒளிஞ்சிருக்கலேன்னு...நீங்க கீழே விழுந்து சுக்குநூறாப் போயிருப்பீங்க!.."
  },
  {
    "id": "vandikkaran-magan-s006-d003",
    "scene_id": "vandikkaran-magan-s006",
    "scene_ordinal": 6,
    "source_scene_id": "5",
    "source_heading": "காட்சி — 5",
    "speaker_label": "டேவிட்",
    "source_delimiter": ":—",
    "source_scene_file": "scene-006.md",
    "page_provenance": [
      {
        "pdf_page": 12,
        "printed_page": 11
      }
    ],
    "text": "ஓ...ஐ ஸீ!..நான் பாத்ரூமுக்குப் போனேன்..பாய்!..."
  },
  {
    "id": "vandikkaran-magan-s006-d004",
    "scene_id": "vandikkaran-magan-s006",
    "scene_ordinal": 6,
    "source_scene_id": "5",
    "source_heading": "காட்சி — 5",
    "speaker_label": "சொக்",
    "source_delimiter": ":—",
    "source_scene_file": "scene-006.md",
    "page_provenance": [
      {
        "pdf_page": 12,
        "printed_page": 11
      }
    ],
    "text": "பாத்ரூமுக்குப் போறேன்னுட்டு பரமண்டலத்துக்கே போயிருப்பீங்க!..இது..கீழே இறங்குகிற கதவுசார்...கதவு!..."
  },
  {
    "id": "vandikkaran-magan-s006-d005",
    "scene_id": "vandikkaran-magan-s006",
    "scene_ordinal": 6,
    "source_scene_id": "5",
    "source_heading": "காட்சி — 5",
    "speaker_label": "டேவிட்",
    "source_delimiter": ":—",
    "source_scene_file": "scene-006.md",
    "page_provenance": [
      {
        "pdf_page": 12,
        "printed_page": 11
      }
    ],
    "text": "(சிரித்தபடி) குட்பாய்!..வெரிகுட் பாய்!...உன்பேர் என்ன தம்பி?.."
  },
  {
    "id": "vandikkaran-magan-s006-d006",
    "scene_id": "vandikkaran-magan-s006",
    "scene_ordinal": 6,
    "source_scene_id": "5",
    "source_heading": "காட்சி — 5",
    "speaker_label": "சொக்",
    "source_delimiter": ":—",
    "source_scene_file": "scene-006.md",
    "page_provenance": [
      {
        "pdf_page": 12,
        "printed_page": 11
      }
    ],
    "text": "சொக்கலிங்கம்!.."
  },
  {
    "id": "vandikkaran-magan-s006-d007",
    "scene_id": "vandikkaran-magan-s006",
    "scene_ordinal": 6,
    "source_scene_id": "5",
    "source_heading": "காட்சி — 5",
    "speaker_label": "டேவிட்",
    "source_delimiter": ":—",
    "source_scene_file": "scene-006.md",
    "page_provenance": [
      {
        "pdf_page": 12,
        "printed_page": 11
      }
    ],
    "text": "குட்!...குட்!...பாய்! நீ எப்படி இங்க வந்தே?"
  },
  {
    "id": "vandikkaran-magan-s006-d008",
    "scene_id": "vandikkaran-magan-s006",
    "scene_ordinal": 6,
    "source_scene_id": "5",
    "source_heading": "காட்சி — 5",
    "speaker_label": "சொக்",
    "source_delimiter": ":—",
    "source_scene_file": "scene-006.md",
    "page_provenance": [
      {
        "pdf_page": 12,
        "printed_page": 11
      }
    ],
    "text": "நான் பொறந்த ஊரை விட்டே ஓடியாந்துட்டேன்!..?"
  },
  {
    "id": "vandikkaran-magan-s006-d009",
    "scene_id": "vandikkaran-magan-s006",
    "scene_ordinal": 6,
    "source_scene_id": "5",
    "source_heading": "காட்சி — 5",
    "speaker_label": "டேவிட்",
    "source_delimiter": ":—",
    "source_scene_file": "scene-006.md",
    "page_provenance": [
      {
        "pdf_page": 12,
        "printed_page": 11
      }
    ],
    "text": "உனக்கு அப்பா அம்மா யாருமே இல்லையா? நீ ஒரு அனாதையா?..."
  },
  {
    "id": "vandikkaran-magan-s006-d010",
    "scene_id": "vandikkaran-magan-s006",
    "scene_ordinal": 6,
    "source_scene_id": "5",
    "source_heading": "காட்சி — 5",
    "speaker_label": "சொக்",
    "source_delimiter": ":—",
    "source_scene_file": "scene-006.md",
    "page_provenance": [
      {
        "pdf_page": 12,
        "printed_page": 11
      }
    ],
    "text": "அனாதை இல்ல சார்...நான் ஓடியாந்து இங்க ஒளிஞ்சதே ஒரு பெரிய கதை சார்!..."
  },
  {
    "id": "vandikkaran-magan-s006-d011",
    "scene_id": "vandikkaran-magan-s006",
    "scene_ordinal": 6,
    "source_scene_id": "5",
    "source_heading": "காட்சி — 5",
    "speaker_label": "டேவிட்",
    "source_delimiter": ":—",
    "source_scene_file": "scene-006.md",
    "page_provenance": [
      {
        "pdf_page": 12,
        "printed_page": 11
      }
    ],
    "text": "ஓ...!ம்.... சொல்லு, சொல்லு!...."
  },
  {
    "id": "vandikkaran-magan-s006-d012",
    "scene_id": "vandikkaran-magan-s006",
    "scene_ordinal": 6,
    "source_scene_id": "5",
    "source_heading": "காட்சி — 5",
    "speaker_label": "சொக்",
    "source_delimiter": ":—",
    "source_scene_file": "scene-006.md",
    "page_provenance": [
      {
        "pdf_page": 12,
        "printed_page": 11
      }
    ],
    "text": "அப்பா மடியிலே உக்காந்துக்குவேன்!.. அம்மாதான் எனக்குச் சோறு ஊட்டுவாங்க!.."
  }
]
