[
  {
    "id": "vandikkaran-magan-s024-d001",
    "scene_id": "vandikkaran-magan-s024",
    "scene_ordinal": 24,
    "source_scene_id": "20",
    "source_heading": "காட்சி — 20",
    "speaker_label": "கோகிலா",
    "source_delimiter": ":—",
    "source_scene_file": "scene-024.md",
    "page_provenance": [
      {
        "pdf_page": 35,
        "printed_page": 34
      }
    ],
    "text": "ஓகோ...புரியுது! புரியுது!...உமா!...நீரில் எழுதிய நினைவுச் சித்திரத்தை ஏன் கலைச்சிட்டே?...யார் அது? அம்மா தமயந்தி! யார் அந்த நளன்? சகுந்தலா! யார் அந்த துஷ்யந்தன்?..."
  },
  {
    "id": "vandikkaran-magan-s024-d002",
    "scene_id": "vandikkaran-magan-s024",
    "scene_ordinal": 24,
    "source_scene_id": "20",
    "source_heading": "காட்சி — 20",
    "speaker_label": "உமா",
    "source_delimiter": ":—",
    "source_scene_file": "scene-024.md",
    "page_provenance": [
      {
        "pdf_page": 35,
        "printed_page": 34
      }
    ],
    "text": "போடி கோகிலா..."
  },
  {
    "id": "vandikkaran-magan-s024-d003",
    "scene_id": "vandikkaran-magan-s024",
    "scene_ordinal": 24,
    "source_scene_id": "20",
    "source_heading": "காட்சி — 20",
    "speaker_label": "கோகிலா",
    "source_delimiter": ":—",
    "source_scene_file": "scene-024.md",
    "page_provenance": [
      {
        "pdf_page": 35,
        "printed_page": 34
      }
    ],
    "text": "உமா!...உமா!...என்கிட்ட மறைக்காதே! எனக்கு எல்லாம் தெரியும்!..கொஞ்ச நாளா நீ..."
  },
  {
    "id": "vandikkaran-magan-s024-d004",
    "scene_id": "vandikkaran-magan-s024",
    "scene_ordinal": 24,
    "source_scene_id": "20",
    "source_heading": "காட்சி — 20",
    "speaker_label": "உமா",
    "source_delimiter": ":—",
    "source_scene_file": "scene-024.md",
    "page_provenance": [
      {
        "pdf_page": 35,
        "printed_page": 34
      }
    ],
    "text": "கோகிலா!...உன்கிட்ட சொல்லிடணும்னு எனக்கு மனசு துடிக்குது...ஆனா..."
  },
  {
    "id": "vandikkaran-magan-s024-d005",
    "scene_id": "vandikkaran-magan-s024",
    "scene_ordinal": 24,
    "source_scene_id": "20",
    "source_heading": "காட்சி — 20",
    "speaker_label": "கோகிலா",
    "source_delimiter": ":—",
    "source_scene_file": "scene-024.md",
    "page_provenance": [
      {
        "pdf_page": 35,
        "printed_page": 34
      }
    ],
    "text": "என்ன?...யாரு?..."
  },
  {
    "id": "vandikkaran-magan-s024-d006",
    "scene_id": "vandikkaran-magan-s024",
    "scene_ordinal": 24,
    "source_scene_id": "20",
    "source_heading": "காட்சி — 20",
    "speaker_label": "உமா",
    "source_delimiter": ":—",
    "source_scene_file": "scene-024.md",
    "page_provenance": [
      {
        "pdf_page": 35,
        "printed_page": 34
      }
    ],
    "text": "நீ என்னு நினைக்கிறே நம்ப செகரட்டரி விங்கன் இருக்காரே..."
  },
  {
    "id": "vandikkaran-magan-s024-d007",
    "scene_id": "vandikkaran-magan-s024",
    "scene_ordinal": 24,
    "source_scene_id": "20",
    "source_heading": "காட்சி — 20",
    "speaker_label": "கோகிலா",
    "source_delimiter": ":—",
    "source_scene_file": "scene-024.md",
    "page_provenance": [
      {
        "pdf_page": 35,
        "printed_page": 34
      }
    ],
    "text": "ஏன் இவ்வளவு கஷ்டம்...அவர்...எப்படிப்பட்டவர்னு பூவா தலையா போட்டுப் பார்த்துடுவோமே!... (தன் ஜாக்கெட்டுக்குள் இருந்து ஒரு ரூபாய் நாணயத்தை எடுத்து) தலைவிழுந்தா அவர் பெரிய குடும்பம்... பூ விழுந்தா...சாதாரண குடும்பம்...சரிதானு?..."
  },
  {
    "id": "vandikkaran-magan-s024-d008",
    "scene_id": "vandikkaran-magan-s024",
    "scene_ordinal": 24,
    "source_scene_id": "20",
    "source_heading": "காட்சி — 20",
    "speaker_label": "விங்கன்",
    "source_delimiter": ":",
    "source_scene_file": "scene-024.md",
    "page_provenance": [
      {
        "pdf_page": 36,
        "printed_page": 35
      }
    ],
    "text": "—"
  },
  {
    "id": "vandikkaran-magan-s024-d009",
    "scene_id": "vandikkaran-magan-s024",
    "scene_ordinal": 24,
    "source_scene_id": "20",
    "source_heading": "காட்சி — 20",
    "speaker_label": "கோகிலா",
    "source_delimiter": ":",
    "source_scene_file": "scene-024.md",
    "page_provenance": [
      {
        "pdf_page": 36,
        "printed_page": 35
      }
    ],
    "text": "—"
  },
  {
    "id": "vandikkaran-magan-s024-d010",
    "scene_id": "vandikkaran-magan-s024",
    "scene_ordinal": 24,
    "source_scene_id": "20",
    "source_heading": "காட்சி — 20",
    "speaker_label": "விங்கன்",
    "source_delimiter": ":",
    "source_scene_file": "scene-024.md",
    "page_provenance": [
      {
        "pdf_page": 36,
        "printed_page": 35
      }
    ],
    "text": "—"
  },
  {
    "id": "vandikkaran-magan-s024-d011",
    "scene_id": "vandikkaran-magan-s024",
    "scene_ordinal": 24,
    "source_scene_id": "20",
    "source_heading": "காட்சி — 20",
    "speaker_label": "கோகிலா",
    "source_delimiter": ":",
    "source_scene_file": "scene-024.md",
    "page_provenance": [
      {
        "pdf_page": 37,
        "printed_page": 36
      }
    ],
    "text": "—"
  },
  {
    "id": "vandikkaran-magan-s024-d012",
    "scene_id": "vandikkaran-magan-s024",
    "scene_ordinal": 24,
    "source_scene_id": "20",
    "source_heading": "காட்சி — 20",
    "speaker_label": "விங்கன்",
    "source_delimiter": ":",
    "source_scene_file": "scene-024.md",
    "page_provenance": [
      {
        "pdf_page": 37,
        "printed_page": 36
      }
    ],
    "text": "—"
  },
  {
    "id": "vandikkaran-magan-s024-d013",
    "scene_id": "vandikkaran-magan-s024",
    "scene_ordinal": 24,
    "source_scene_id": "20",
    "source_heading": "காட்சி — 20",
    "speaker_label": "கோகிலா",
    "source_delimiter": ":",
    "source_scene_file": "scene-024.md",
    "page_provenance": [
      {
        "pdf_page": 37,
        "printed_page": 36
      }
    ],
    "text": "—"
  },
  {
    "id": "vandikkaran-magan-s024-d014",
    "scene_id": "vandikkaran-magan-s024",
    "scene_ordinal": 24,
    "source_scene_id": "20",
    "source_heading": "காட்சி — 20",
    "speaker_label": "விங்கன்",
    "source_delimiter": ":",
    "source_scene_file": "scene-024.md",
    "page_provenance": [
      {
        "pdf_page": 37,
        "printed_page": 36
      }
    ],
    "text": "—"
  }
]
