[
  {
    "id": "vandikkaran-magan-s009-d001",
    "scene_id": "vandikkaran-magan-s009",
    "scene_ordinal": 9,
    "source_scene_id": "8",
    "source_heading": "காட்சி — 8",
    "speaker_label": "டேவிட்",
    "source_delimiter": ":—",
    "source_scene_file": "scene-009.md",
    "page_provenance": [
      {
        "pdf_page": 16,
        "printed_page": 15
      }
    ],
    "text": "(சிறுவன் கண்களில் நீர்த்துளிகள்... அதனைத் தன் விரல்களால் துடைத்துவிட்டவாறு...) மை பாய்!.. கவலைப்படாதே!.. கடவுள்தான் உன்னைக் கொண்டு வந்து என்னிடம் சேர்த்து வைத்திருக்கிறார்.... இனிமேற் கொண்டு நீ என்னிடமே இருக்கலாம்.... உன்னை வளர்த்து ஆளாக்கவேண்டிய பொறுப்பு என்னுடையது! என்ன சரிதானு?... ம்.. சரி என்று உன் தலையை ஆட்டு..."
  },
  {
    "id": "vandikkaran-magan-s009-d002",
    "scene_id": "vandikkaran-magan-s009",
    "scene_ordinal": 9,
    "source_scene_id": "8",
    "source_heading": "காட்சி — 8",
    "speaker_label": "டேவிட்",
    "source_delimiter": ":—",
    "source_scene_file": "scene-009.md",
    "page_provenance": [
      {
        "pdf_page": 16,
        "printed_page": 15
      }
    ],
    "text": "மிகவும் நல்லது!.. ம்.. பாய்! உன் பெயர் என்ன சொன்னாய்?..."
  },
  {
    "id": "vandikkaran-magan-s009-d003",
    "scene_id": "vandikkaran-magan-s009",
    "scene_ordinal": 9,
    "source_scene_id": "8",
    "source_heading": "காட்சி — 8",
    "speaker_label": "சொக்க",
    "source_delimiter": ":—",
    "source_scene_file": "scene-009.md",
    "page_provenance": [
      {
        "pdf_page": 16,
        "printed_page": 15
      }
    ],
    "text": "சொக்கலிங்கம்!.."
  },
  {
    "id": "vandikkaran-magan-s009-d004",
    "scene_id": "vandikkaran-magan-s009",
    "scene_ordinal": 9,
    "source_scene_id": "8",
    "source_heading": "காட்சி — 8",
    "speaker_label": "டேவிட்",
    "source_delimiter": ":—",
    "source_scene_file": "scene-009.md",
    "page_provenance": [
      {
        "pdf_page": 16,
        "printed_page": 15
      }
    ],
    "text": "சுக்கு லிங்கம்!..."
  },
  {
    "id": "vandikkaran-magan-s009-d005",
    "scene_id": "vandikkaran-magan-s009",
    "scene_ordinal": 9,
    "source_scene_id": "8",
    "source_heading": "காட்சி — 8",
    "speaker_label": "சொக்க",
    "source_delimiter": ":—",
    "source_scene_file": "scene-009.md",
    "page_provenance": [
      {
        "pdf_page": 16,
        "printed_page": 15
      }
    ],
    "text": "ஊஹூம்!.. சொக்க..லிங்கம்!..."
  },
  {
    "id": "vandikkaran-magan-s009-d006",
    "scene_id": "vandikkaran-magan-s009",
    "scene_ordinal": 9,
    "source_scene_id": "8",
    "source_heading": "காட்சி — 8",
    "speaker_label": "டேவிட்",
    "source_delimiter": ":—",
    "source_scene_file": "scene-009.md",
    "page_provenance": [
      {
        "pdf_page": 16,
        "printed_page": 15
      }
    ],
    "text": "ஏன் வம்பு... இனிமேல் நான் உன்னை லிங்கன் என்றே கூப்பிடுவேன்!..."
  }
]
