[
  {
    "id": "vandikkaran-magan-s026-d001",
    "scene_id": "vandikkaran-magan-s026",
    "scene_ordinal": 26,
    "source_scene_id": "21",
    "source_heading": "காட்சி — 21",
    "speaker_label": "ஜமீன்தார்",
    "source_delimiter": ":—",
    "source_scene_file": "scene-026.md",
    "page_provenance": [
      {
        "pdf_page": 39,
        "printed_page": 38
      }
    ],
    "text": "மிஸ்டர் விங்கன்!..எந்தக் கணக்கு இடிக்குதுன்னு சொன்னீங்க!..."
  },
  {
    "id": "vandikkaran-magan-s026-d002",
    "scene_id": "vandikkaran-magan-s026",
    "scene_ordinal": 26,
    "source_scene_id": "21",
    "source_heading": "காட்சி — 21",
    "speaker_label": "விங்கன்",
    "source_delimiter": ":—",
    "source_scene_file": "scene-026.md",
    "page_provenance": [
      {
        "pdf_page": 39,
        "printed_page": 38
      }
    ],
    "text": "நம்ம ஜமீன்கிராமங்களிலே விவசாயிகள் கட்டவேண்டிய கிஸ்தி பூரா கட்டியிருக்காங்க!.. அதுக்குக் கணக்கு இருக்கு!..ஆனா..நம்மகிட்ட இருப்பு இருக்கிற உணவு தானியம் ரொம்ப குறைவா இருக்கு..."
  },
  {
    "id": "vandikkaran-magan-s026-d003",
    "scene_id": "vandikkaran-magan-s026",
    "scene_ordinal": 26,
    "source_scene_id": "21",
    "source_heading": "காட்சி — 21",
    "speaker_label": "ஜமீன்தார்",
    "source_delimiter": ":—",
    "source_scene_file": "scene-026.md",
    "page_provenance": [
      {
        "pdf_page": 39,
        "printed_page": 38
      }
    ],
    "text": "உணவு தானியம், கணக்கிலே குறைவா இருக்கும்!.. நம்ம களஞ்சியத்திலே சரியா இருக்கும்!.."
  },
  {
    "id": "vandikkaran-magan-s026-d004",
    "scene_id": "vandikkaran-magan-s026",
    "scene_ordinal": 26,
    "source_scene_id": "21",
    "source_heading": "காட்சி — 21",
    "speaker_label": "விங்கன்",
    "source_delimiter": ":—",
    "source_scene_file": "scene-026.md",
    "page_provenance": [
      {
        "pdf_page": 39,
        "printed_page": 38
      }
    ],
    "text": "அப்படின்னு..களஞ்சியத்திலே..பாழாப்போற தானியத்தை ஏழைபாழைகளுக்குக் கொடுக்கலாமே!.."
  },
  {
    "id": "vandikkaran-magan-s026-d005",
    "scene_id": "vandikkaran-magan-s026",
    "scene_ordinal": 26,
    "source_scene_id": "21",
    "source_heading": "காட்சி — 21",
    "speaker_label": "ஜமீன்தார்",
    "source_delimiter": ":—",
    "source_scene_file": "scene-026.md",
    "page_provenance": [
      {
        "pdf_page": 39,
        "printed_page": 38
      }
    ],
    "text": "நல்லா சொன்னீங்க போங்க!..மிஸ்டர் விங்கன்!... களஞ்சியத்திலே இருக்கிற தானியம் எதுவும் பாழாப்போகாது.. அப்படியே பணமா மாறும்!.. அதுவும் கறுப்புப்பணமா மாறும்!..விங்கன்! இதெல்லாம் நம்ம ஜமீன் ரகசியங்கள்!..சாவி ஜாக்கிரதையா காப்பாத்தணும்!..மேலும்..."
  },
  {
    "id": "vandikkaran-magan-s026-d006",
    "scene_id": "vandikkaran-magan-s026",
    "scene_ordinal": 26,
    "source_scene_id": "21",
    "source_heading": "காட்சி — 21",
    "speaker_label": "உமா",
    "source_delimiter": ":—",
    "source_scene_file": "scene-026.md",
    "page_provenance": [
      {
        "pdf_page": 39,
        "printed_page": 38
      }
    ],
    "text": "அப்பா! அப்பா!..."
  },
  {
    "id": "vandikkaran-magan-s026-d007",
    "scene_id": "vandikkaran-magan-s026",
    "scene_ordinal": 26,
    "source_scene_id": "21",
    "source_heading": "காட்சி — 21",
    "speaker_label": "ஜமீன்தார்",
    "source_delimiter": ":—",
    "source_scene_file": "scene-026.md",
    "page_provenance": [
      {
        "pdf_page": 39,
        "printed_page": 38
      }
    ],
    "text": "உமா கண்ணு என்னம்மா?..."
  },
  {
    "id": "vandikkaran-magan-s026-d008",
    "scene_id": "vandikkaran-magan-s026",
    "scene_ordinal": 26,
    "source_scene_id": "21",
    "source_heading": "காட்சி — 21",
    "speaker_label": "உமா",
    "source_delimiter": ":—",
    "source_scene_file": "scene-026.md",
    "page_provenance": [
      {
        "pdf_page": 39,
        "printed_page": 38
      }
    ],
    "text": "அப்பா! நான் இன்னைக்கு நம்ம எஸ்டேட்டுக்குப் போயிட்டு நாளைக்கு வந்துடறேன்!.."
  },
  {
    "id": "vandikkaran-magan-s026-d009",
    "scene_id": "vandikkaran-magan-s026",
    "scene_ordinal": 26,
    "source_scene_id": "21",
    "source_heading": "காட்சி — 21",
    "speaker_label": "ஜமீன்தார்",
    "source_delimiter": ":—",
    "source_scene_file": "scene-026.md",
    "page_provenance": [
      {
        "pdf_page": 39,
        "printed_page": 38
      }
    ],
    "text": "போயிட்டு வாம்மா!.. தனியா குதிரையிலே கிளம்பிடாதே!..என் வண்டியை எடுத்துக்கிட்டு போ!.."
  },
  {
    "id": "vandikkaran-magan-s026-d010",
    "scene_id": "vandikkaran-magan-s026",
    "scene_ordinal": 26,
    "source_scene_id": "21",
    "source_heading": "காட்சி — 21",
    "speaker_label": "உமா",
    "source_delimiter": ":—",
    "source_scene_file": "scene-026.md",
    "page_provenance": [
      {
        "pdf_page": 39,
        "printed_page": 38
      }
    ],
    "text": "சரிப்பா!..."
  },
  {
    "id": "vandikkaran-magan-s026-d011",
    "scene_id": "vandikkaran-magan-s026",
    "scene_ordinal": 26,
    "source_scene_id": "21",
    "source_heading": "காட்சி — 21",
    "speaker_label": "ஜமீன்தார்",
    "source_delimiter": ":—",
    "source_scene_file": "scene-026.md",
    "page_provenance": [
      {
        "pdf_page": 39,
        "printed_page": 38
      }
    ],
    "text": "உமா!..வண்டியையும் நீயே ஓட்டிக்கிட்டு புறப்பட்டுடாதே!..வண்டிக்கார சடையன அழைச்சிக்கிட்டுப் போ!"
  },
  {
    "id": "vandikkaran-magan-s026-d012",
    "scene_id": "vandikkaran-magan-s026",
    "scene_ordinal": 26,
    "source_scene_id": "21",
    "source_heading": "காட்சி — 21",
    "speaker_label": "உமா",
    "source_delimiter": ":—",
    "source_scene_file": "scene-026.md",
    "page_provenance": [
      {
        "pdf_page": 39,
        "printed_page": 38
      }
    ],
    "text": "சரிப்பா!"
  },
  {
    "id": "vandikkaran-magan-s026-d013",
    "scene_id": "vandikkaran-magan-s026",
    "scene_ordinal": 26,
    "source_scene_id": "21",
    "source_heading": "காட்சி — 21",
    "speaker_label": "ஜமீன்தார்",
    "source_delimiter": ":—",
    "source_scene_file": "scene-026.md",
    "page_provenance": [
      {
        "pdf_page": 39,
        "printed_page": 38
      }
    ],
    "text": "நீ பயணத்துக்கு ரெடியாயிடு!..சடையனே நான் அனுப்புறேன்!.."
  },
  {
    "id": "vandikkaran-magan-s026-d014",
    "scene_id": "vandikkaran-magan-s026",
    "scene_ordinal": 26,
    "source_scene_id": "21",
    "source_heading": "காட்சி — 21",
    "speaker_label": "உமா",
    "source_delimiter": ":—",
    "source_scene_file": "scene-026.md",
    "page_provenance": [
      {
        "pdf_page": 39,
        "printed_page": 38
      }
    ],
    "text": "சரிப்பா!..."
  },
  {
    "id": "vandikkaran-magan-s026-d015",
    "scene_id": "vandikkaran-magan-s026",
    "scene_ordinal": 26,
    "source_scene_id": "21",
    "source_heading": "காட்சி — 21",
    "speaker_label": "ஜமீன்தார்",
    "source_delimiter": ":—",
    "source_scene_file": "scene-026.md",
    "page_provenance": [
      {
        "pdf_page": 40,
        "printed_page": 39
      }
    ],
    "text": "மிஸ்டர் விங்கன்!..நம்ம வண்டிக்கார சடையனுக்குச் சொல்லி அனுப்பி..உமாவோட எஸ்டேட்டுக்குப் போகச் சொல்லுங்க!.."
  },
  {
    "id": "vandikkaran-magan-s026-d016",
    "scene_id": "vandikkaran-magan-s026",
    "scene_ordinal": 26,
    "source_scene_id": "21",
    "source_heading": "காட்சி — 21",
    "speaker_label": "விங்கன்",
    "source_delimiter": ":—",
    "source_scene_file": "scene-026.md",
    "page_provenance": [
      {
        "pdf_page": 40,
        "printed_page": 39
      }
    ],
    "text": "ஓ எஸ்!..ஓகே!..."
  }
]
