[
  {
    "id": "vandikkaran-magan-s056-d001",
    "scene_id": "vandikkaran-magan-s056",
    "scene_ordinal": 56,
    "source_scene_id": "43",
    "source_heading": "காட்சி -- 43",
    "speaker_label": "உமா",
    "source_delimiter": ":—",
    "source_scene_file": "scene-056.md",
    "page_provenance": [
      {
        "pdf_page": 70,
        "printed_page": 69
      }
    ],
    "text": "அத்தான்!...அப்பாவிடம் ஒரு வார்த்தை,..."
  },
  {
    "id": "vandikkaran-magan-s056-d002",
    "scene_id": "vandikkaran-magan-s056",
    "scene_ordinal": 56,
    "source_scene_id": "43",
    "source_heading": "காட்சி -- 43",
    "speaker_label": "விங்கன்",
    "source_delimiter": ":—",
    "source_scene_file": "scene-056.md",
    "page_provenance": [
      {
        "pdf_page": 70,
        "printed_page": 69
      }
    ],
    "text": "அப்பாவிடம் விடை பெற்றுக்கொள்! அனுமதி கேட்காதே!...."
  },
  {
    "id": "vandikkaran-magan-s056-d003",
    "scene_id": "vandikkaran-magan-s056",
    "scene_ordinal": 56,
    "source_scene_id": "43",
    "source_heading": "காட்சி -- 43",
    "speaker_label": "ஜமீன்தார்",
    "source_delimiter": ":—",
    "source_scene_file": "scene-056.md",
    "page_provenance": [
      {
        "pdf_page": 70,
        "printed_page": 69
      }
    ],
    "text": "(வந்து கொண்டே) என்ன மாப்பிள்ளே?..இதெல்லாம் என்ன விபரீதம்?..."
  },
  {
    "id": "vandikkaran-magan-s056-d004",
    "scene_id": "vandikkaran-magan-s056",
    "scene_ordinal": 56,
    "source_scene_id": "43",
    "source_heading": "காட்சி -- 43",
    "speaker_label": "விங்கன்",
    "source_delimiter": ":—",
    "source_scene_file": "scene-056.md",
    "page_provenance": [
      {
        "pdf_page": 70,
        "printed_page": 69
      }
    ],
    "text": "விபரீதங்களைத்தாங்கிக்கொள்ள முடியாமல்தான் வெளியேறுகிறேன்!...உங்கள் மகளுக்கு விடைகொடுத்தனுப்புங்கள்!..."
  },
  {
    "id": "vandikkaran-magan-s056-d005",
    "scene_id": "vandikkaran-magan-s056",
    "scene_ordinal": 56,
    "source_scene_id": "43",
    "source_heading": "காட்சி -- 43",
    "speaker_label": "ஜமீன்தார்",
    "source_delimiter": ":—",
    "source_scene_file": "scene-056.md",
    "page_provenance": [
      {
        "pdf_page": 70,
        "printed_page": 69
      }
    ],
    "text": "சடையா!...பார்த்தியா?..எப்படி செல்வமா வளர்ந்த பெண்ணை..விரல் அசைத்தால் வேலை செய்ய நூறு வேலைக்காரர்களிடமிருந்து இட்ட வேலையைத் தட்டாம செய்கிற அந்தஸ்த்து, ஆடம்பரம் நிறைந்த இந்த மாளிகையிலே பிறந்து வளர்ந்த பெண்ணை..மண் குடிசைக்கு அழைச்சிக்கிட்டு போறேங்கிறாரே மாப்பிள்ளை...இது நியாயமா?..."
  },
  {
    "id": "vandikkaran-magan-s056-d006",
    "scene_id": "vandikkaran-magan-s056",
    "scene_ordinal": 56,
    "source_scene_id": "43",
    "source_heading": "காட்சி -- 43",
    "speaker_label": "சடையன்",
    "source_delimiter": ":—",
    "source_scene_file": "scene-056.md",
    "page_provenance": [
      {
        "pdf_page": 70,
        "printed_page": 69
      }
    ],
    "text": "எம்ப்பா, உனக்கு என்ன..பைத்தியம் பிடிச்சுட்டுதா? ஏண்டா இந்த வேலையெல்லாம் செய்ற? ஏண்டா எஜமான் மனசிலே இவ்வளவு பெரிய வேதனையை உண்டாக்குறே?..அதுவும் வயிற்றுப்பிள்ளையா இருக்கிற பெண்ணை அழைச்சிக்கிட்டு போறேங்கிறியே!..."
  },
  {
    "id": "vandikkaran-magan-s056-d007",
    "scene_id": "vandikkaran-magan-s056",
    "scene_ordinal": 56,
    "source_scene_id": "43",
    "source_heading": "காட்சி -- 43",
    "speaker_label": "விங்கன்",
    "source_delimiter": ":—",
    "source_scene_file": "scene-056.md",
    "page_provenance": [
      {
        "pdf_page": 70,
        "printed_page": 69
      }
    ],
    "text": "உமா! புறப்படு!..."
  },
  {
    "id": "vandikkaran-magan-s056-d008",
    "scene_id": "vandikkaran-magan-s056",
    "scene_ordinal": 56,
    "source_scene_id": "43",
    "source_heading": "காட்சி -- 43",
    "speaker_label": "ஜமீன்தார்",
    "source_delimiter": ":—",
    "source_scene_file": "scene-056.md",
    "page_provenance": [
      {
        "pdf_page": 70,
        "printed_page": 69
      }
    ],
    "text": "உமா!...."
  },
  {
    "id": "vandikkaran-magan-s056-d009",
    "scene_id": "vandikkaran-magan-s056",
    "scene_ordinal": 56,
    "source_scene_id": "43",
    "source_heading": "காட்சி -- 43",
    "speaker_label": "உமா",
    "source_delimiter": ":—",
    "source_scene_file": "scene-056.md",
    "page_provenance": [
      {
        "pdf_page": 70,
        "printed_page": 69
      }
    ],
    "text": "அப்பா! மன்னிச்சிடுங்க! அவர் இருக்கிற இடம்தான் எனக்கு சொர்க்கம்!..நான் வர்றேன்!..(விங்கனிடம்) போகலாமா?..."
  },
  {
    "id": "vandikkaran-magan-s056-d010",
    "scene_id": "vandikkaran-magan-s056",
    "scene_ordinal": 56,
    "source_scene_id": "43",
    "source_heading": "காட்சி -- 43",
    "speaker_label": "விங்கன்",
    "source_delimiter": ":—",
    "source_scene_file": "scene-056.md",
    "page_provenance": [
      {
        "pdf_page": 70,
        "printed_page": 69
      }
    ],
    "text": "(ஜமீன்தாரிடம்) வர்றேன்!...நாங்க ஒண்ணும் தொலை தூரம் போய்விடவில்லை. அதனாலே தொடர்பு விட்டுப் போகாது... (சடையனிடம்) அப்பா! நான் தவறு செய்ற மாதிரி தெரியும்!...ஆனா..உண்மை போகப் போகப் புரியும்!..மன்னிச்சிடுங்க! வரட்டுமா...உமா!..வா!..."
  },
  {
    "id": "vandikkaran-magan-s056-d011",
    "scene_id": "vandikkaran-magan-s056",
    "scene_ordinal": 56,
    "source_scene_id": "43",
    "source_heading": "காட்சி -- 43",
    "speaker_label": "சடையன்",
    "source_delimiter": ":—",
    "source_scene_file": "scene-056.md",
    "page_provenance": [
      {
        "pdf_page": 70,
        "printed_page": 69
      }
    ],
    "text": "(ஜமீன்தார் காலடியில் விழுந்து) எஜமான்..என்னை மன்னிச்சிடுங்க!..."
  },
  {
    "id": "vandikkaran-magan-s056-d012",
    "scene_id": "vandikkaran-magan-s056",
    "scene_ordinal": 56,
    "source_scene_id": "43",
    "source_heading": "காட்சி -- 43",
    "speaker_label": "ஜமீன்தார்",
    "source_delimiter": ":—",
    "source_scene_file": "scene-056.md",
    "page_provenance": [
      {
        "pdf_page": 70,
        "printed_page": 69
      }
    ],
    "text": "(மனதில் குரோத உணர்வுடன்) உம்!..காலில் விழக் கூடாது!..சம்பந்தி...சம்பந்தியே இருக்கணும்!...."
  }
]
